{
  "schemaVersion": 1,
  "productId": "siroino-moonlit-patisserie-uniform-set",
  "units": "meter",
  "layoutStatus": "PROVISIONAL_UNMEASURED_2D",
  "evaluationBoundary": "Estimated flat-pattern coordinates from the two-view concept. This graph expresses pocket placement and a proposed U-shaped topstitch path only; it does not assert attachment, sewing, fit, 3D, or appearance acceptance.",
  "overlays": [
    {
      "overlayId": "left-apron-pocket",
      "hostPieceId": "apron-front-panel",
      "overlayPieceId": "apron-pocket-left",
      "mirrorGroupId": "apron-pocket-pair",
      "side": "left",
      "transform": {
        "anchorLocalM": [0.05, 0.0],
        "targetPointOnHostM": [-0.105, -0.075],
        "rotationDegrees": 0.0,
        "mirrorX": true
      },
      "openingEdgeId": "pocket-mouth",
      "attachmentEdgeIds": [
        "pocket-mouth-round-right",
        "pocket-side-right-upper",
        "pocket-side-right",
        "pocket-bottom-right",
        "pocket-bottom-center-right",
        "pocket-bottom-center-left",
        "pocket-side-left",
        "pocket-mouth-round-left"
      ],
      "attachmentHypothesis": "planned-topstitch"
    },
    {
      "overlayId": "right-apron-pocket",
      "hostPieceId": "apron-front-panel",
      "overlayPieceId": "apron-pocket-right",
      "mirrorGroupId": "apron-pocket-pair",
      "side": "right",
      "transform": {
        "anchorLocalM": [0.05, 0.0],
        "targetPointOnHostM": [0.105, -0.075],
        "rotationDegrees": 0.0,
        "mirrorX": false
      },
      "openingEdgeId": "pocket-mouth",
      "attachmentEdgeIds": [
        "pocket-mouth-round-right",
        "pocket-side-right-upper",
        "pocket-side-right",
        "pocket-bottom-right",
        "pocket-bottom-center-right",
        "pocket-bottom-center-left",
        "pocket-side-left",
        "pocket-mouth-round-left"
      ],
      "attachmentHypothesis": "planned-topstitch"
    }
  ]
}
